{
  "schema": "privometry.license/v1",
  "license_id": "lic_01JAC0000000000000000000A2",
  "customer_name": "Acme Bank Ltd",
  "deployment": "air_gapped",
  "issued_at": "2026-10-23T09:00:00.000Z",
  "entitlements": {
    "schema": "privometry.entitlements/v1",
    "org_id": "org_01JA0000000000000000000001",
    "edition": "enterprise",
    "features": {
      "local_guard": true,
      "scanner": true,
      "local_timeline": true,
      "community_feed": true,
      "cloud_sync": true,
      "shared_policies": true,
      "inventory": true,
      "findings_basic": true,
      "approvals": true,
      "curated_feed": true,
      "ticketing_sync": true,
      "sso_scim": true,
      "mdm_rollout": true,
      "managed_hooks": true,
      "tamper_detection": true,
      "governance": true,
      "policy_simulation": true,
      "kill_switch": true,
      "audit_replay": true,
      "compliance_reports": true,
      "siem_export": true,
      "mcp_gateway": true,
      "self_hosted": true
    },
    "limits": {
      "seats": 500,
      "retention_days": 400,
      "events_per_day": 5000000,
      "devices_per_user": null
    },
    "valid_from": "2026-10-01T00:00:00.000Z",
    "valid_until": "2026-10-15T00:00:00.000Z",
    "grace_days": 30,
    "post_expiry_retention_days": 30,
    "state": "grace",
    "issued_at": "2026-10-23T09:00:00.000Z",
    "key_id": "license:in-1:8a1f0c2e7b14d685"
  },
  "binding": {
    "installation_id": "inst-7f3a9c2d41"
  }
}
